### ISSUE TITLE
Ping request could not find host

### ISSUE THREAD

**Issue by ssgoogle** [wangyu-/udp2raw-multiplatform#2]
按照wiki【udp2raw+UDPspeeder+OpenVPN原生运行在windows/macOS上加速全流量】
可以ping通10.111.2.1，ping其他都失败了。

11:29:23.295457 IP 10.111.2.14.59044 > google-public-dns-a.google.com.domain: 31696+ A? www.cnbeta.com. (32)
11:29:24.296530 IP 10.111.2.14.59044 > google-public-dns-a.google.com.domain: 31696+ A? www.cnbeta.com. (32)
11:29:24.718404 IP 10.111.2.14.59538 > google-public-dns-a.google.com.domain: 40462+ A? media.steampowered.com. (40)

好像是DNS请求没有回复，请大佬指导下

**Comment by ssgoogle** [comment]
新开一个VPS实例，就没有问题了。
